{
  "$schema": "https://json-schema.org/draft/2020-12/schema",
  "$id": "urn:editorial:diff-page:1.1.0",
  "title": "DiffPage v1.1",
  "type": "object",
  "additionalProperties": false,
  "properties": {
    "articleId": {"type": "string", "format": "uuid"},
    "fromVersionId": {"type": "string", "format": "uuid"},
    "toVersionId": {"type": "string", "format": "uuid"},
    "offset": {"type": "integer", "minimum": 0, "maximum": 60001},
    "totalBlocks": {"type": "integer", "minimum": 2, "maximum": 60002},
    "blocks": {
      "type": "array", "maxItems": 100,
      "items": {
        "type": "object", "additionalProperties": false,
        "properties": {
          "blockId": {"type": "string", "minLength": 1, "maxLength": 80},
          "kind": {"type": "string", "enum": ["ADD", "DELETE", "CHANGE", "UNCHANGED"]},
          "before": {"type": "string", "maxLength": 30000},
          "after": {"type": "string", "maxLength": 30000}
        },
        "required": ["blockId", "kind", "before", "after"]
      }
    },
    "nextCursor": {"type": ["string", "null"], "maxLength": 1000}
  },
  "required": ["articleId", "fromVersionId", "toVersionId", "offset", "totalBlocks", "blocks", "nextCursor"]
}
