{"articleId":"66c5a999-f562-49a3-9bc7-445ca00cd0da","fromVersionId":"acdcfef6-7b9f-46f0-b95a-f0c8bf5fb74f","toVersionId":"4cfc394f-8fe2-475e-adc4-ca5db5f6acba","offset":0,"totalBlocks":1004,"blocks":[{"blockId":"title","kind":"CHANGE","before":"原文标题","after":"Changed 😀 title"},{"blockId":"subtitle","kind":"UNCHANGED","before":"","after":""},{"blockId":"5284f4aa-caa1-4d3f-ac81-c8a036200c59","kind":"UNCHANGED","before":"原文测试材料原文测试材料原文测试材料原文测试材料原文测试材料原文测试材料原文测试材料原文测试材料原文测试材料原文测试材料原文测试材料原文测试材料原文测试材料原文测试材料原文测试材料原文测试材料原文测试材料原文测试材料原文测试材料原文测试材料原文测试材料原文测试材料原文测试材料原文测试材料原文测试材料原文测试材料原文测试材料原文测试材料原文测试材料原文测试材料原文测试材料原文测试材料原文测试材料原文测试材料原文测试材料原文测试材料原文测试材料原文测试材料原文测试材料原文测试材料原文测试材料原文测试材料原文测试材料原文测试材料原文测试材料原文测试材料原文测试材料原文测试材料原文测试材料原文测试材料原文测试材料原文测试材料原文测试材料原文测试材料原文测试材料原文测试材料原文测试材料原文测试材料原文测试材料原文测试材料原文测试材料原文测试材料原文测试材料原文测试材料原文测试材料原文测试材料原文测试材料原文测试材料原文测试材料原文测试材料原文测试材料原文测试材料原文测试材料原文测试材料原文测试材料原文测试材料原文测试材料原文测试材料原文测试材料原文测试材料原文测试材料原文测试材料原文测试材料原文测试材料原文测试材料原文测试材料原文测试材料原文测试材料原文测试材料原文测试材料原文测试材料原文测试材料原文测试材料原文测试材料原文测试材料原文测试材料原文测试材料原文测试材料原文测试材料原文测试材料原文测试材料原文测试材料原文测试材料原文测试材料原文测试材料原文测试材料原文测试材料原文测试材料原文测试材料原文测试材料原文测试材料原文测试材料原文测试材料原文测试材料原文测试材料原文测试材料原文测试材料原文测试材料原文测试材料原文测试材料原文测试材料原文测试材料原文测试材料原文测试材料原文测试材料原文测试材料原文测试材料原文测试材料原文测试材料原文测试材料原文测试材料原文测试材料原文测试材料原文测试材料原文测试材料原文测试材料原文测试材料原文测试材料原文测试材料原文测试材料原文测试材料原文测试材料原文测试材料原文测试材料原文测试材料原文测试材料原文测试材料原文测试材料原文测试材料原文测试材料原文测试材料原文测试材料原文测试材料原文测试材料原文测试材料原文测试材料原文测试材料原文测试材料原文测试材料原文测试材料原文测试材料原文测试材料原文测试材料原文测试材料原文测试材料原文测试材料原文测试材料原文测试材料原文测试材料原文测试材料原文测试材料原文测试材料原文测试材料原文测试材料原文测试材料原文测试材料原文测试材料原文测试材料原文测试材料原文测试材料原文测试材料原文测试材料原文测试材料原文测试材料原文测试材料原文测试材料原文测试材料原文测试材料原文测试材料原文测试材料原文测试材料原文测试材料原文测试材料原文测试材料原文测试材料原文测试材料原文测试材料原文测试材料原文测试材料原文测试材料原文测试材料原文测试材料原文测试材料原文测试材料原文测试材料原文测试材料原文测试材料原文测试材料原文测试材料原文测试材料原文测试材料原文测试材料原文测试材料原文测试材料原文测试材料原文测试材料原文测试材料原文测试材料原文测试材料原文测试材料原文测试材料原文测试材料原文测试材料原文测试材料原文测试材料原文测试材料原文测试材料原文测试材料原文测试材料原文测试材料原文测试材料原文测试材料原文测试材料原文测试材料原文测试材料原文测试材料原文测试材料原文测试材料原文测试材料原文测试材料原文测试材料原文测试材料原文测试材料原文测试材料原文测试材料原文测试材料原文测试材料原文测试材料原文测试材料原文测试材料原文测试材料原文测试材料原文测试材料原文测试材料原文测试材料原文测试材料原文测试材料原文测试材料原文测试材料原文测试材料原文测试材料原文测试材料原文测试材料原文测试材料原文测试材料原文测试材料原文测试材料原文测试材料原文测试材料原文测试材料原文测试材料原文测试材料原文测试材料原文测试材料原文测试材料原文测试材料原文测试材料原文测试材料原文测试材料原文测试材料原文测试材料原文测试材料原文测试材料原文测试材料原文测试材料原文测试材料原文测试材料原文测试材料原文测试材料原文测试材料原文测试材料原文测试材料原文测试材料原文测试材料原文测试材料原文测试材料原文测试材料原文测试材料原文测试材料原文测试材料原文测试材料原文测试材料原文测试材料原文测试材料原文测试材料原文测试材料原文测试材料原文测试材料原文测试材料原文测试材料原文测试材料原文测试材料原文测试材料原文测试材料原文测试材料原文测试材料原文测试材料原文测试材料原文测试材料原文测试材料原文测试材料原文测试材料原文测试材料原文测试材料原文测试材料原文测试材料原文测试材料原文测试材料原文测试材料原文测试材料原文测试材料原文测试材料原文测试材料原文测试材料原文测试材料原文测试材料原文测试材料原文测试材料原文测试材料原文测试材料原文测试材料原文测试材料原文测试材料原文测试材料原文测试材料原文测试材料原文测试材料原文测试材料原文测试材料原文测试材料原文测试材料原文测试材料原文测试材料原文测试材料原文测试材料原文测试材料原文测试材料原文测试材料原文测试材料原文测试材料原文测试材料原文测试材料原文测试材料原文测试材料原文测试材料原文测试材料原文测试材料原文测试材料原文测试材料原文测试材料原文测试材料原文测试材料原文测试材料原文测试材料原文测试材料原文测试材料原文测试材料原文测试材料原文测试材料原文测试材料原文测试材料原文测试材料原文测试材料原文测试材料原文测试材料原文测试材料原文测试材料原文测试材料原文测试材料原文测试材料原文测试材料原文测试材料原文测试材料原文测试材料原文测试材料原文测试材料原文测试材料原文测试材料原文测试材料原文测试材料原文测试材料原文测试材料原文测试材料原文测试材料原文测试材料原文测试材料原文测试材料原文测试材料原文测试材料原文测试材料原文测试材料原文测试材料原文测试材料原文测试材料原文测试材料原文测试材料原文测试材料原文测试材料原文测试材料原文测试材料原文测试材料原文测试材料原文测试材料原文测试材料原文测试材料原文测试材料原文测试材料原文测试材料原文测试材料原文测试材料原文测试材料原文测试材料原文测试材料原文测试材料原文测试材料原文测试材料原文测试材料原文测试材料原文测试材料原文测试材料原文测试材料原文测试材料原文测试材料原文测试材料原文测试材料原文测试材料原文测试材料原文测试材料原文测试材料原文测试材料原文测试材料原文测试材料原文测试材料原文测试材料原文测试材料原文测试材料原文测试材料原文测试材料原文测试材料原文测试材料原文测试材料原文测试材料原文测试材料原文测试材料原文测试材料原文测试材料原文测试材料原文测试材料原文测试材料原文测试材料原文测试材料原文测试材料原文测试材料原文测试材料原文测试材料原文测试材料原文测试材料原文测试材料原文测试材料原文测试材料原文测试材料原文测试材料原文测试材料原文测试材料原文测试材料原文测试材料原文测试材料原文测试材料原文测试材料原文测试材料原文测试材料原文测试材料原文测试材料原文测试材料原文测试材料原文测试材料原文测试材料原文测试材料原文测试材料原文测试材料","after":"原文测试材料原文测试材料原文测试材料原文测试材料原文测试材料原文测试材料原文测试材料原文测试材料原文测试材料原文测试材料原文测试材料原文测试材料原文测试材料原文测试材料原文测试材料原文测试材料原文测试材料原文测试材料原文测试材料原文测试材料原文测试材料原文测试材料原文测试材料原文测试材料原文测试材料原文测试材料原文测试材料原文测试材料原文测试材料原文测试材料原文测试材料原文测试材料原文测试材料原文测试材料原文测试材料原文测试材料原文测试材料原文测试材料原文测试材料原文测试材料原文测试材料原文测试材料原文测试材料原文测试材料原文测试材料原文测试材料原文测试材料原文测试材料原文测试材料原文测试材料原文测试材料原文测试材料原文测试材料原文测试材料原文测试材料原文测试材料原文测试材料原文测试材料原文测试材料原文测试材料原文测试材料原文测试材料原文测试材料原文测试材料原文测试材料原文测试材料原文测试材料原文测试材料原文测试材料原文测试材料原文测试材料原文测试材料原文测试材料原文测试材料原文测试材料原文测试材料原文测试材料原文测试材料原文测试材料原文测试材料原文测试材料原文测试材料原文测试材料原文测试材料原文测试材料原文测试材料原文测试材料原文测试材料原文测试材料原文测试材料原文测试材料原文测试材料原文测试材料原文测试材料原文测试材料原文测试材料原文测试材料原文测试材料原文测试材料原文测试材料原文测试材料原文测试材料原文测试材料原文测试材料原文测试材料原文测试材料原文测试材料原文测试材料原文测试材料原文测试材料原文测试材料原文测试材料原文测试材料原文测试材料原文测试材料原文测试材料原文测试材料原文测试材料原文测试材料原文测试材料原文测试材料原文测试材料原文测试材料原文测试材料原文测试材料原文测试材料原文测试材料原文测试材料原文测试材料原文测试材料原文测试材料原文测试材料原文测试材料原文测试材料原文测试材料原文测试材料原文测试材料原文测试材料原文测试材料原文测试材料原文测试材料原文测试材料原文测试材料原文测试材料原文测试材料原文测试材料原文测试材料原文测试材料原文测试材料原文测试材料原文测试材料原文测试材料原文测试材料原文测试材料原文测试材料原文测试材料原文测试材料原文测试材料原文测试材料原文测试材料原文测试材料原文测试材料原文测试材料原文测试材料原文测试材料原文测试材料原文测试材料原文测试材料原文测试材料原文测试材料原文测试材料原文测试材料原文测试材料原文测试材料原文测试材料原文测试材料原文测试材料原文测试材料原文测试材料原文测试材料原文测试材料原文测试材料原文测试材料原文测试材料原文测试材料原文测试材料原文测试材料原文测试材料原文测试材料原文测试材料原文测试材料原文测试材料原文测试材料原文测试材料原文测试材料原文测试材料原文测试材料原文测试材料原文测试材料原文测试材料原文测试材料原文测试材料原文测试材料原文测试材料原文测试材料原文测试材料原文测试材料原文测试材料原文测试材料原文测试材料原文测试材料原文测试材料原文测试材料原文测试材料原文测试材料原文测试材料原文测试材料原文测试材料原文测试材料原文测试材料原文测试材料原文测试材料原文测试材料原文测试材料原文测试材料原文测试材料原文测试材料原文测试材料原文测试材料原文测试材料原文测试材料原文测试材料原文测试材料原文测试材料原文测试材料原文测试材料原文测试材料原文测试材料原文测试材料原文测试材料原文测试材料原文测试材料原文测试材料原文测试材料原文测试材料原文测试材料原文测试材料原文测试材料原文测试材料原文测试材料原文测试材料原文测试材料原文测试材料原文测试材料原文测试材料原文测试材料原文测试材料原文测试材料原文测试材料原文测试材料原文测试材料原文测试材料原文测试材料原文测试材料原文测试材料原文测试材料原文测试材料原文测试材料原文测试材料原文测试材料原文测试材料原文测试材料原文测试材料原文测试材料原文测试材料原文测试材料原文测试材料原文测试材料原文测试材料原文测试材料原文测试材料原文测试材料原文测试材料原文测试材料原文测试材料原文测试材料原文测试材料原文测试材料原文测试材料原文测试材料原文测试材料原文测试材料原文测试材料原文测试材料原文测试材料原文测试材料原文测试材料原文测试材料原文测试材料原文测试材料原文测试材料原文测试材料原文测试材料原文测试材料原文测试材料原文测试材料原文测试材料原文测试材料原文测试材料原文测试材料原文测试材料原文测试材料原文测试材料原文测试材料原文测试材料原文测试材料原文测试材料原文测试材料原文测试材料原文测试材料原文测试材料原文测试材料原文测试材料原文测试材料原文测试材料原文测试材料原文测试材料原文测试材料原文测试材料原文测试材料原文测试材料原文测试材料原文测试材料原文测试材料原文测试材料原文测试材料原文测试材料原文测试材料原文测试材料原文测试材料原文测试材料原文测试材料原文测试材料原文测试材料原文测试材料原文测试材料原文测试材料原文测试材料原文测试材料原文测试材料原文测试材料原文测试材料原文测试材料原文测试材料原文测试材料原文测试材料原文测试材料原文测试材料原文测试材料原文测试材料原文测试材料原文测试材料原文测试材料原文测试材料原文测试材料原文测试材料原文测试材料原文测试材料原文测试材料原文测试材料原文测试材料原文测试材料原文测试材料原文测试材料原文测试材料原文测试材料原文测试材料原文测试材料原文测试材料原文测试材料原文测试材料原文测试材料原文测试材料原文测试材料原文测试材料原文测试材料原文测试材料原文测试材料原文测试材料原文测试材料原文测试材料原文测试材料原文测试材料原文测试材料原文测试材料原文测试材料原文测试材料原文测试材料原文测试材料原文测试材料原文测试材料原文测试材料原文测试材料原文测试材料原文测试材料原文测试材料原文测试材料原文测试材料原文测试材料原文测试材料原文测试材料原文测试材料原文测试材料原文测试材料原文测试材料原文测试材料原文测试材料原文测试材料原文测试材料原文测试材料原文测试材料原文测试材料原文测试材料原文测试材料原文测试材料原文测试材料原文测试材料原文测试材料原文测试材料原文测试材料原文测试材料原文测试材料原文测试材料原文测试材料原文测试材料原文测试材料原文测试材料原文测试材料原文测试材料原文测试材料原文测试材料原文测试材料原文测试材料原文测试材料原文测试材料原文测试材料原文测试材料原文测试材料原文测试材料原文测试材料原文测试材料原文测试材料原文测试材料原文测试材料原文测试材料原文测试材料原文测试材料原文测试材料原文测试材料原文测试材料原文测试材料原文测试材料原文测试材料原文测试材料原文测试材料原文测试材料原文测试材料原文测试材料原文测试材料原文测试材料原文测试材料原文测试材料原文测试材料原文测试材料原文测试材料原文测试材料原文测试材料原文测试材料原文测试材料原文测试材料原文测试材料原文测试材料原文测试材料原文测试材料原文测试材料原文测试材料原文测试材料原文测试材料原文测试材料原文测试材料原文测试材料原文测试材料原文测试材料原文测试材料原文测试材料原文测试材料原文测试材料原文测试材料原文测试材料原文测试材料"},{"blockId":"paged0","kind":"ADD","before":"","after":"字"},{"blockId":"paged1","kind":"ADD","before":"","after":"字"},{"blockId":"paged2","kind":"ADD","before":"","after":"字"},{"blockId":"paged3","kind":"ADD","before":"","after":"字"},{"blockId":"paged4","kind":"ADD","before":"","after":"字"},{"blockId":"paged5","kind":"ADD","before":"","after":"字"},{"blockId":"paged6","kind":"ADD","before":"","after":"字"},{"blockId":"paged7","kind":"ADD","before":"","after":"字"},{"blockId":"paged8","kind":"ADD","before":"","after":"字"},{"blockId":"paged9","kind":"ADD","before":"","after":"字"},{"blockId":"paged10","kind":"ADD","before":"","after":"字"},{"blockId":"paged11","kind":"ADD","before":"","after":"字"},{"blockId":"paged12","kind":"ADD","before":"","after":"字"},{"blockId":"paged13","kind":"ADD","before":"","after":"字"},{"blockId":"paged14","kind":"ADD","before":"","after":"字"},{"blockId":"paged15","kind":"ADD","before":"","after":"字"},{"blockId":"paged16","kind":"ADD","before":"","after":"字"},{"blockId":"paged17","kind":"ADD","before":"","after":"字"},{"blockId":"paged18","kind":"ADD","before":"","after":"字"},{"blockId":"paged19","kind":"ADD","before":"","after":"字"},{"blockId":"paged20","kind":"ADD","before":"","after":"字"},{"blockId":"paged21","kind":"ADD","before":"","after":"字"},{"blockId":"paged22","kind":"ADD","before":"","after":"字"},{"blockId":"paged23","kind":"ADD","before":"","after":"字"},{"blockId":"paged24","kind":"ADD","before":"","after":"字"},{"blockId":"paged25","kind":"ADD","before":"","after":"字"},{"blockId":"paged26","kind":"ADD","before":"","after":"字"},{"blockId":"paged27","kind":"ADD","before":"","after":"字"},{"blockId":"paged28","kind":"ADD","before":"","after":"字"},{"blockId":"paged29","kind":"ADD","before":"","after":"字"},{"blockId":"paged30","kind":"ADD","before":"","after":"字"},{"blockId":"paged31","kind":"ADD","before":"","after":"字"},{"blockId":"paged32","kind":"ADD","before":"","after":"字"},{"blockId":"paged33","kind":"ADD","before":"","after":"字"},{"blockId":"paged34","kind":"ADD","before":"","after":"字"},{"blockId":"paged35","kind":"ADD","before":"","after":"字"},{"blockId":"paged36","kind":"ADD","before":"","after":"字"},{"blockId":"paged37","kind":"ADD","before":"","after":"字"},{"blockId":"paged38","kind":"ADD","before":"","after":"字"},{"blockId":"paged39","kind":"ADD","before":"","after":"字"},{"blockId":"paged40","kind":"ADD","before":"","after":"字"},{"blockId":"paged41","kind":"ADD","before":"","after":"字"},{"blockId":"paged42","kind":"ADD","before":"","after":"字"},{"blockId":"paged43","kind":"ADD","before":"","after":"字"},{"blockId":"paged44","kind":"ADD","before":"","after":"字"},{"blockId":"paged45","kind":"ADD","before":"","after":"字"},{"blockId":"paged46","kind":"ADD","before":"","after":"字"},{"blockId":"paged47","kind":"ADD","before":"","after":"字"},{"blockId":"paged48","kind":"ADD","before":"","after":"字"},{"blockId":"paged49","kind":"ADD","before":"","after":"字"},{"blockId":"paged50","kind":"ADD","before":"","after":"字"},{"blockId":"paged51","kind":"ADD","before":"","after":"字"},{"blockId":"paged52","kind":"ADD","before":"","after":"字"},{"blockId":"paged53","kind":"ADD","before":"","after":"字"},{"blockId":"paged54","kind":"ADD","before":"","after":"字"},{"blockId":"paged55","kind":"ADD","before":"","after":"字"},{"blockId":"paged56","kind":"ADD","before":"","after":"字"},{"blockId":"paged57","kind":"ADD","before":"","after":"字"},{"blockId":"paged58","kind":"ADD","before":"","after":"字"},{"blockId":"paged59","kind":"ADD","before":"","after":"字"},{"blockId":"paged60","kind":"ADD",